{
  "schema_version": "net.local_ipc.channel.v1",
  "ipc_channel_id": "ipc_demo_platform_ipc_future",
  "transport_adapter_id": "transport_demo_local_ipc",
  "endpoint_id": "endpoint_demo_local_ipc",
  "channel_label": "Demo platform IPC future channel",
  "channel_kind": "platform_ipc_future",
  "channel_scope": "session",
  "channel_state": "declared",
  "channel_security": "same_user_future",
  "channel_ref": "ipc-platform-future://demo",
  "metadata": {
    "synthetic": true,
    "declared_only": true,
    "no_ipc_io": true,
    "no_filesystem_path": true,
    "note": "Future descriptor only; no platform IPC is created."
  },
  "declared_at_unix_ms": 0
}
