{
  "schema_version": "net.local_ipc.channel.v1",
  "ipc_channel_id": "ipc_demo_memory_channel_future",
  "transport_adapter_id": "transport_demo_local_ipc",
  "endpoint_id": "endpoint_demo_local_ipc",
  "channel_label": "Demo memory channel future IPC channel",
  "channel_kind": "memory_channel_future",
  "channel_scope": "future",
  "channel_state": "unknown",
  "channel_security": "untrusted",
  "channel_ref": "ipc-memory-future://demo",
  "metadata": {
    "synthetic": true,
    "declared_only": true,
    "no_ipc_io": true,
    "no_filesystem_path": true,
    "note": "Future descriptor only; no memory channel is created."
  },
  "declared_at_unix_ms": 0
}
