{
  "schema_version": "net.local_ipc.channel.v1",
  "ipc_channel_id": "ipc_demo_named_pipe_future",
  "transport_adapter_id": "transport_demo_local_ipc",
  "endpoint_id": "endpoint_demo_local_ipc",
  "channel_label": "Demo named pipe future IPC channel",
  "channel_kind": "named_pipe_future",
  "channel_scope": "machine",
  "channel_state": "declared",
  "channel_security": "declared_local",
  "channel_ref": "ipc-named-pipe-future://demo",
  "metadata": {
    "synthetic": true,
    "declared_only": true,
    "no_ipc_io": true,
    "no_filesystem_path": true,
    "note": "Future descriptor only; no named pipe is created."
  },
  "declared_at_unix_ms": 0
}
