{
  "schema_version": "net.local_ipc.channel.v1",
  "ipc_channel_id": "ipc_demo_abstract_local",
  "transport_adapter_id": "transport_demo_local_ipc",
  "endpoint_id": "endpoint_demo_local_ipc",
  "channel_label": "Demo abstract local IPC channel",
  "channel_kind": "abstract_local",
  "channel_scope": "process",
  "channel_state": "declared",
  "channel_security": "local_only",
  "channel_ref": "ipc-abstract://demo",
  "metadata": {
    "synthetic": true,
    "declared_only": true,
    "no_ipc_io": true,
    "no_filesystem_path": true,
    "note": "Abstract descriptor only; no channel is created."
  },
  "declared_at_unix_ms": 0
}
